Section,Element,Cardinality,Required,Field Title,Description,Property,Property Range Comments,Comments,Visibility,Example,Type,Default Value,Controlled Terms,Lookup,Ontology
,,,Optional,Longitude,Location of this point in east longitude decimal degrees (western longitudes are negative),http://purl.org/radx-terms/metadata-terms/longitude,,,,,float,,,,
,>Data File Geopolitical Coverage,MULTIPLE,,,A region specified by the totality of one or more place names,http://purl.org/radx-terms/metadata-terms/geographicalPlaceNameDescriptor,,,,,,,,,
,,MULTIPLE,Optional,Geopolitical region ,Place name depicting a geopolitical region,http://purl.org/radx-terms/metadata-terms/geographicalPlaceName,,,,,,,,https://bioportal.bioontology.org/ontologies/GAZ,
,Data File Elevation Coverage,MULTIPLE,,,The elevation  covered by the data file being described.,http://purl.org/radx-terms/metadata-terms/elevationCoverageDescriptor,,,,,,,,,
,,,Optional,Vertical Extent Minimum Value,"A minimum vertical extent in metres of the data file collection. In case of depth, this contains the maximum depth of data file collection (it is a negative number of greater absolute magnitude than the Vertical Extent Maximum Value).  Note that the unit is metres.",http://purl.org/radx-terms/metadata-terms/minElevation,,,,,float,,,,
,,,Optional,Vertical Extent Maximum Value,"A maximum vertical extent in metres of data file collection. In case of depth, this contains the minimum depth of data file collection (it is a negative number of lesser absolute magnitude than the Vertical Extent Minimum Value).  Note that the unit is metres.",http://purl.org/radx-terms/metadata-terms/maxElevation,,,,,float,,,,
,,,Optional,Vertical Extent Datum,The name of the Datum (reference frame) used for the Vertical Extent values.,http://purl.org/radx-terms/metadata-terms/elevationReferenceFrame,,,,,,,,,
,,,Optional,Vertical Extent Datum IRI,The IRI (Internationalized Resource Identifier) of the Datum (reference frame) used for the Vertical Extent values.,http://purl.org/radx-terms/metadata-terms/elevationReferenceFrameIri,,,,,IRI,,,,
Additional Information,,,,,,,,,,,,,,,
,Auxiliary Metadata,,,,Information about the data file or metadata submission that does not fit into the other categories,http://purl.org/radx-terms/metadata-terms/auxiliaryMetadataDescriptor,,,,,,,,,
,,MULTIPLE,Optional,Data File Descriptive Attribute,"This field supports entry of both the metadata attribute name (in the first field), and the value for that attribute (in the second field). Note this is a repeating field and so can support multiple key-value pairs.",http://purl.org/radx-terms/metadata-terms/auxiliaryMetadataKey,,,,,Attribute-Value,,,,
,,MULTIPLE,Optional,Additional Commentary,Any additional information about the data file or provided metadata.,http://purl.org/radx-terms/metadata-terms/auxiliaryMetadataValue,,,,,textarea,,,,